<?xml version="1.0" encoding="UTF-8"?>
<!ELEMENT questions (question)+>
<!ELEMENT question (type,title,options*,answer+)>
<!ATTLIST question id ID #REQUIRED>
<!ELEMENT type (#PCDATA)>
<!ELEMENT title (#PCDATA)>
<!ELEMENT options (#PCDATA)>
<!ELEMENT answer (#PCDATA)>
